{
  "$schema": "https://json-schema.org/draft/2020-12/schema",
  "$id": "https://agentpass.dev/contracts/promotion-evidence-v2.schema.json",
  "title": "AgentPass managed release promotion evidence v2",
  "type": "object",
  "additionalProperties": false,
  "required": ["version", "type", "statement", "statement_hash", "signature_algorithm", "signer_key_fingerprint", "signature"],
  "properties": {
    "version": { "const": 2 },
    "type": { "const": "agentpass.promotion-evidence" },
    "statement": { "$ref": "#/$defs/statement" },
    "statement_hash": { "$ref": "#/$defs/digest" },
    "signature_algorithm": { "const": "ed25519" },
    "signer_key_fingerprint": { "$ref": "#/$defs/fingerprint" },
    "signature": { "$ref": "#/$defs/signature" }
  },
  "$defs": {
    "digest": { "type": "string", "pattern": "^[0-9a-f]{64}$" },
    "commit": { "type": "string", "pattern": "^[0-9a-f]{40}$" },
    "timestamp": { "type": "string", "format": "date-time", "pattern": "^\\d{4}-\\d{2}-\\d{2}T\\d{2}:\\d{2}:\\d{2}\\.\\d{3}Z$" },
    "identifier": { "type": "string", "minLength": 1, "maxLength": 256, "pattern": "^[A-Za-z0-9][A-Za-z0-9._:/-]{0,255}$" },
    "fingerprint": { "type": "string", "pattern": "^SHA256:[A-Za-z0-9_-]{43}$" },
    "signature": { "type": "string", "pattern": "^[A-Za-z0-9_-]{86}$" },
    "statement": {
      "type": "object",
      "additionalProperties": false,
      "required": ["version", "type", "environment", "candidate_id", "source_commit", "source_tree", "artifact_sha256", "release_manifest_schema_version", "release_manifest_sha256", "purpose", "protocol_version", "signing_version", "lifecycle_version", "key_id", "key_version", "issued_at", "expires_at"],
      "properties": {
        "version": { "const": 2 },
        "type": { "const": "agentpass.promotion-evidence" },
        "environment": { "enum": ["staging", "production"] },
        "candidate_id": { "type": "string", "pattern": "^release-pkg-sha256-v1-[0-9a-f]{64}$" },
        "source_commit": { "$ref": "#/$defs/commit" },
        "source_tree": { "$ref": "#/$defs/commit" },
        "artifact_sha256": { "$ref": "#/$defs/digest" },
        "release_manifest_schema_version": { "const": 4 },
        "release_manifest_sha256": { "$ref": "#/$defs/digest" },
        "purpose": { "const": "agentpass.promotion-evidence" },
        "protocol_version": { "const": 2 },
        "signing_version": { "const": 2 },
        "lifecycle_version": { "type": "integer", "minimum": 1, "maximum": 9007199254740991 },
        "key_id": { "$ref": "#/$defs/identifier" },
        "key_version": { "type": "integer", "minimum": 1, "maximum": 9007199254740991 },
        "issued_at": { "$ref": "#/$defs/timestamp" },
        "expires_at": { "$ref": "#/$defs/timestamp" }
      }
    }
  }
}
